Definitive Bright Morning,"Noted to be the definitive bright morning of 10,000 calendars.

The church bell melted.

Rage of unrequited love became a terrible serpent.

The morning star lowered like an enemy’s flag.

A vampire’s mattress tumbled out at the outskirts of town.

Ancient lanterns, suddenly thrown through the air,

somewhere deep in the mountains.

That night, in a snowy rural area, an elderly, powder-faced woman

appeared on doorsteps in search of wine.

Her origins, neatly wrapped in the cold dressing of a snowflake’s breath.",Mythology and Folklore
Hillbilly Leviathan,"The Ozarks are where defeated assassins, the unholy,
and monsters come to retire.
The proper soil and crooked moonlight grow back
the disemboweled, the decapitated,
while we collect arrears in child support for our demi-god children.

The procession of taillights lined deep down the logging trails.
Along the way, there was a gentleman arguing with his soul
over his suicide.

I, tongue of snakes.
Cut up, dipped in powdered sugar,
scattered to the ants in the deepest corner of Mt. Nebo
as an insult, bind my ghost to the mountain.

Typhoon collected the few precious scales left of me
from the undertow.
My southern accent-muscle burned up
from haunting your life/house.

Now, let daybreak be my head and the year, my whole body.
An online southern Christian university ordained my smoker’s
cough to be a dove.
My favorite exorcism:
The demon, steeped in corn bread philosophy,
does not have enough ass to carry off the jeans he advertises
as he kneels down to the priest and holy water.

Years ago, as a child, I climbed the levee and made a hole in the air.
That’s where I will rest, but the gate is not wide enough.
Like my burial site, I am party-size.",Mythology and Folklore
Laughter,"These words of two, three years ago returned.
— Ryūnosuke Akutagawa, tr. by Will Petersen
one day, Coyote sees Duck walking her ducklings,
Coyote asks her how she keeps them in a straight line,
Duck says she sews them together
with white horsetail hair every morning
and tugs on the line gently,
until the horsehair disappears,
that is how she keeps her ducklings in a row

as usual, Coyote leaves smiling, she sees a white horse
grazing in a nearby field,
she plucks a few strands of tail hair
and returns to her burrow

the next morning, one by one
she begins to sew her pups together

when she finishes, she gently tugs on the horsehair
and drags their little bodies along the ground,
Coyote tilts her head in dismay and becomes distraught,
she realizes she has killed her little pups

“Indians” will laugh about anything and anyone,
no matter the tragedy",Mythology and Folklore
Typhoni,"This is the deepest part of the world.

Bird don’t fly here,
but there is the sound of wings.

The smell, just a struggle in the earth
underneath the musty floorboards.

Monsters hatch fully-grown from their eggs.
Snaky legs indicate chaos.

I carry sad omens,

slobber down the psychic’s legs
to her feet pointed backwards.

I roll off the back of a skull strapped on top
of a fox who shape-shifts into the irresistible.

A Christian, Oklahoma-shaped and melancholic,
caught at the entrance of a ditch

as the best breath of me tornadoes into the next county.",Mythology and Folklore
Matariki,"The time of breathing into clasped hands
hovering over a lighter to make a flame

not knowing
that an angry man threw his eyes into the night

the belly of his shattered father
weeping rain for separation of earth and sky

harvesting bitter grudges
from minds like hardened soil

packing up the wounds with mud and whiskey
and opening doors to wait

for those curious to know
how sky maps granted our existence

how the weight of earth
pushed against tongues of oars

and our tīpuna pushed back
and won.",Mythology and Folklore
Stepping Stones,"Our islands are Tagaloaalagi’s stepping stones across Le Vasa Loloa
small and frail but courageous enough to bear his weight and mana

high enough to keep us above the drowning and learning
how to navigate by the stars    currents and the ferocity of storms

Point and sail in any direction as long as you know
how to return home

You have to navigate the space between the borders
of your skin and the intelligence of the tongueless horizon

and learn the language of touch    of signs and pain
of what isn’t and what may be in the circle of the tides

that will stretch until you understand the permanent silence
at the end of your voyage

and our islands are your anchor and launching site
for the universes that repeat and repeat

like the long waves of our ocean    like Tagaloaalagi’s
compulsive scrutiny of what is to come and fear",Mythology and Folklore
