Arcadia,"1


Just as there were reeds along the riverbank,
Just as there were clouds
Above my head, my lute was lying beside me on the grass.

I placed the little finger of my right hand on the soundboard,
Just below the strings.
Not the tip of the finger, the side.

I curled the palm of my right hand towards me,
Covering the strings, so that I played
The bass note with the thumb,
The next with the index,
And the top note with the third.

The sun retreated, the night turned cold.
Rain began to fall, softly at first,
Though surely rain had fallen here before, as rain falls everywhere.

With my left hand, I positioned my thumb and index finger
Opposite each other, bearing no weight,
As if the neck of the lute were not there.


2


At this they all laughed.

Then the Count began afresh: My lords, he said, I am not pleased with the young man if he is not also a musician, and if, besides his cunning upon the book, he have not skill in like manner on sundry instruments. There is no ease of labor more honest and more praiseworthy, especially at court, where many things are taken in hand to please women, whose tender breasts are soon pierced with melody.

Then the Lord Gasper: I believe music, he said, together with other vanities, is mete for women, also for them that have the likeness of men, but not for them that be men indeed, who ought not with such delicacies womanize their minds and so bring themselves to dread death.

— The First Booke of the Courtyer of Count Baldessar Castilio


3


For many years I lived apart, in happy oblivion.
In retrospect, I understand I’d been a child,
Though lacking comparisons I couldn’t have said so.

I learned things, things no child, left to himself, could possibly know.
My head, which had been empty, now was full.

My head would grow larger.
How could it not?

At night, standing in the shower, I closed my eyes.
The water trickled down my forehead
To my nose, from my nose to my lips, my chin, then disappeared.

But some of what stayed in my head
Should not have been there.


4


Listen, said the reeds along the riverbank: the nymphs
Are weeping for Daphnis.
His mother embraces his body, railing against the stars.

Nobody drives his cattle to the cool stream, no one could drink;
The mountains echo with the beasts of the desert.

Daphnis, it was you who yoked them to the chariot,
Who led us in the dance, weaving
Together vine leaves with reeds.

The vine exceeds the tree on which it climbs.
The grape exceeds the vine,
The calf the herd, the corn the field.

Now, where we planted barley, thistles grow.
Where once were violets, hyacinths — nothing but weeds.

Scatter the ground with flowers, shepherds,
Set out two bowls,
One of milk and one of oil.
Then carve these lines from Virgil on his tomb:

I was Daphnis in these woods.
The stars knew my name.
Beautiful the flock, more beautiful the shepherd.",Mythology and Folklore
Dialogue with an Artist,"the lonely


Incorporating the words of L.S. Lowry


I used to paint the sea, but never a shore,
and nobody was sailing on it. It wasn’t even
the sea, it was just my own loneliness.

It’s all there, you know. It’s all in the sea.
The battle is there, the inevitability of it all,
the purpose. When I switched to people

they were all lonely. Crowds are the
loneliest thing of all, I say. Every individual
in them is a stranger to everyone else.

I would stand for hours in one spot
and scores of little kids who hadn’t had
a wash for weeks would group round me.

Had I not been lonely, none of my work
would have happened. I should not have
done what I’ve done, or seen what I’ve seen.

There’s something grotesque in me and I
can’t help it. I’m drawn to others who are
like that. They’re very real people. It’s just

I’m attracted to sadness and there are some
very sad things. These people are ghostly
figures. They’re my mood, they’re myself.

Lately, I started a big self-portrait. I thought
I won’t want this thing, no one will, so
I went and turned it into a grotesque head.


memo to lowry


You’re right, there are grotesques who shine
a dark light that lures us like how the sirens
tried to lure Odysseus, and yes, maybe we
ourselves are among the grotesques, but
there are also the beautiful who, if we’re
lucky, save us from ourselves, and validate
the sun’s light, and maybe also the moon’s.",Mythology and Folklore
From “Dark Honey”,"In homage to Osip Mandelshtam
I am sure I do
not believe we can
move a pencil through
a white field, pulled by
a team of upside-
down ox-head letter
As, and in real fact
furrow it. Poor old
page-earth — sized, cut, scraped,
ploughed with mule-pencils
or impressed by ink,
illuminated,
printed, obscurely
inscribed, and revered
or destroyed, revered
and destroyed, and here
comes yet another
walled-garden crop for
eye, ear, lungs, legs, mind.


•


The cranium dome
hangs from its own silk
conceptual thread
of thought, conceiving
its infinite in-
complete perfection:
its Zeno, its Zeus,
its Dante, its Te
Deums and freak shows,
frescoes, twine theory,
money, bread, bricks and
wine, six-syllable
abstractions, axes
and facts, its every
variation of
custom, including
vertical graves of
men buried upside
down without their heads.

•


(In dusk-lit, telling
ways, tell me, little
swallow, Tuscan or
T’ang or wrung somehow
from time: since I have
neither feather nor
wing, how I too can
go into a grave
made only of air.)

•


“For your sweet joy, take
“from my cupped hands a
“little glittering
“of sun, a little
“honey — for this is
“what Persephone’s
“bees have commanded.

“A boat can’t cast off
“if it isn’t moored;
“no one can hear a
“shadow that wears fur
“boots; we can’t best our
“fright in this dark wood.

“Our kisses — these are
“all that we can save,
“velvety as bees
“that die if they are
“exiled from the hive.

“They’re murmuring in
“the transparent groves
“of the night; the wilds
“of mountain Greece are
“their motherland; their
“diet is time, lung-
“wort, pale meadowsweet.

“For joy, please take this
“pagan gift: this rude,
“rustling necklace of
“the bees that died, for
“these had transmuted
“honey into sun.”",Mythology and Folklore
Thor and Saturn’s Tête-à-tête,"To thwart? To abet? To mete?
Quixotic cobbler, spread apocryphal

mendacity from Styx to Mt. Dix.
Yoke check to bank, broadcast

flaccid gospel. Raze it! Scorch it!
It’s summertime in Mendocino.

Ah, poke stigmatized feet-stank.
Quotidian Stygian, pack funk-stuffed

rucksacks into boats of dope(d) diction.
Fuck Friday. Yes, you, Freya. Be fazed.",Mythology and Folklore
Conriocht [Werewolf],"Chonac smólach marbh sa choill
é seargtha ar an screablach.
Bhíos ag déanamh trua de
nuair a tháinig madraí de rúid
is thugadar ruathar fúm
ag snapadh, ag glamadh
agus drant orthu.
Uaimse do tháinig liúbhéic,
gach bagairt is buille coise:
Bhí ina bhúirchath eadrainn.
Chorraigh na ba sna goirt
is chuireadar leis an gcór allta.
Theith lucha is dallóga fraoigh
isteach faoin doire donn,
sheas madra rua ar shiolpa,
a cholainn iomlán righin.
Chuimhníos ar mo choisíocht;
bhí ceithre chrúb fúm.






I saw a thrush-corpse shriveling
on the woodland’s scrabbly floor.
I was busy pitying it
when there came a harrying pack
of strays that set about me;
they bayed and snapped,
growling bare-toothed.
From my throat such roaring;
my every curse and foot-swing
made a bellow-war between us.
Fields of agitated cattle
augmented that wild choir.
Mice and shrewmice shrunk back
into the oakleaf brown interior
as a fox reared upward on a stony ridge,
its stance utterly rigid.
I remembered to run,
felt the four paws under me.

Translated from the Irish by Billy Ramsell",Mythology and Folklore
The Donnellys,"Someone in an accent of seduction whispered salmon.
Then someone filled a bucket up with sleep.

Mermaidism in the Donnelly house
was five sisters deep.",Mythology and Folklore
A Sound Box,"Down, unequal weight on his haunches
and the rain driving his shirt sideways,
his legs are as rigid as the stone and timber
that props him up. Ears, half-opened lips
slurred to bits; a head no longer able
to troubleshoot the broken glass inside him.


•


Wiry treetops are blacker. The after-rain light
diffused to near neon-gray. There was a boy
seen by neighbors running the width of the field.
One said he disappeared — as if he fell headlong
into the horizon. Another said it wasn’t a boy,
but a hart. Next to nothing left where Evans
was found, but there was a sound box,
some thing in which his soul made itself felt.",Mythology and Folklore
The Elements,"You must do battle with Eros       I am
more worried about space, pressed for details
collapsed in chaos with my sword holding up the sky the
girl said. They cared not for love lying ever that they loved
But I your leader wounded in gender and bleeding
for Eros fought it away from my true beginning as now.

Always climbing that hill in several ways.
One goes past the Baptist Church and through the ugly
trees, houses I only visualize in dreams
you have no right to pursue me to my origins man
as bipolar as the one candidate, forgettable
as the other. We once lived in a postwar barracks blue
heated by a black stove of assumptions
Eros a youth admits no equal; Aphrodite the slut;
Chaos is whom I admire that keeps forgetting
love in favor of this terrible mixity I am
for example ... these poems. Out of the pre-beginning

a different beauty. They want you to confess
something like in church, that a man will
save you. But I am your leader savior and poet
I am your general out of the desert thee
most ardent void precursor of love
Eros approaches again not the man but quality
sculpted genitals arush with the words
of unreason: I will never die. Which I is I
if I can remain chaotic I’ll tell you who you are

that you’ve never anticipated, but know
the only one. Without a thing. To be is not
to have; nor to belong; nor to have been born.
You are not the child of earth. Beauty still thy name.",Mythology and Folklore
Consider Oedipus’s Father,"It could have been a car door
                leaving that bruise,

as any mom knows,
almost anything could take an eye out,

and almost anybody could get their tongue
                frozen to a pole,

which is kind of funny
                to the point of tears
                plus a knee slap or two
that an eye can be made blue, pink
by a baby’s fist, it fits
perfectly in the socket. It’s happened to me.
                Get it?

Any scenario is better,
beats sitting in a car and hearing
                someone you love
                sob,
which I have done
with a black eye.

For me, a woman’s tears
are IKEA instructions
on the European side.

I’m sure for Laius, Oedipus’s father, it was the same.
                Think of him sleeping
after having held a crying Jocasta
because they had fought for hours
because she was stronger.

                Who knew better the anger of young Jocasta?
Knew that when the oracle, or the police,
                come, they are taking someone with them.

I’m sure Laius looked at the crib
                and thought better you
than me, kid.

Now consider your own
father, or the guy your mother
                dated until he took
the three-sided road,

crouched in front of a paper
                plate with a catcher’s
                mitt, teaching
                a curveball grip —

                but did he ever teach
the essential lesson
of how to block a punch
                from a finely manicured hand,
or to walk away when
records are being candled and books disemboweled,

teach the wonderment of
                a jar of peanut butter jammed
in a TV screen
below a snail trail of ice cream
                near broken pictures on the wall?

Not while he’s king, I bet, and not while
                there are mothers and their jobs,
like breastfeeding or serving a warm plate
                on a table

next
to cold beers
                from the hand

of a mother he made from a virgin
                with his own hands, his own hands.",Mythology and Folklore
The Dancing Plague,"Who was the woman who lived in the kingdom behind the barrier.
There are those who will tell you she was the wife of every man in the village.
And one night while her husbands were finishing their day at the gasworks,
the woman was boiling oats for her only child,
a young girl who’d amassed a beautiful collection of spoons in her life,
each one given to her by one of her mother’s husbands.
And this same night the young daughter died.
And the woman buried the daughter with her spoons in her pockets.
Come daybreak the hostiles appeared at the barrier with ice in their beards.
“To hell with Pax Americana,” they said.
And they camped outside the wall that night chanting war cries.
You say you want to know the names of the war cries that survived history.
“Wheel the gun carriages up to the barrier of the empire of husbands.”
“Our first word is ruin and our next word is value.”
There are those who will tell you the hostiles carried on like this for some weeks.
Until one night the dead daughter led them behind the barrier,
through a tunnel she’d dug in the earth with her spoons.
It was thus the hostiles made it their business to burn everything.
They burned the village crops and the distillery.
They burned the apothecary, the potash mine.
Black soot fell on the livery and they burned the livery too.
And there’s another war cry that’s since survived history:
“Tonight like god’s scalp in your kingdom behind the barrier
our burning makes snow and ends nowhere.”
You say, where were the village husbands while all of this was happening.
There are those who will tell you they were working their jobs at the gasworks,
and when they heard the bullhorn roar in the watchtower
they were smoking cigarillos and pacing the floor of the gasworks.
And the roar of the bullhorn had a strange effect on the husbands,
who each began daydreaming of his wife at home in the village.
The first husband thought: “The taste of the breath of my wife,
it’s like saying the word houndstooth to myself in the dark.”
The next husband thought of her letting her hair down in front of a vanity,
and smearing her blue eye shadow onto her fingers,
and plucking the stray hairs and flyaways off her head.
The next husband thought of her saying, “I’m correcting god’s blunders,”
when he asked her why she wears all this foundation on her face.
Another husband thought: “Quitting time is worthless to me
so long as the work I do in the gasworks makes me think of my wife’s jawbone.”
And all together the husbands said: “The jawbones of my wife,
they beat both the same, like when I watch a train leave the kingdom,
and all I can see is the pistons beating away in the smoke.”
And when the hostiles entered the gasworks the husbands were dancing.
And you say you want to know the words the hostiles spoke when they entered.
There are those who will tell you they said this: “Don’t quit dancing.”
“There’s a penalty for an empire that believes it can survive itself,” they said.
And so they pointed their war clubs at the husbands,
and they said don’t quit, don’t quit dancing on the floor of the gasworks,
and they bludgeoned to death the husbands who refused to keep dancing,
and one by one the husbands fell dead on the floor of the gasworks,
each one dancing himself to death at the hands of the hostiles.

And this dancing took many deaths.

But you say where was the wife who lost all her husbands this day.
There are those who will tell you she was hiding the last of the cheese in a boot.
She was rolling up the deed to her house in the village.
She was picking up her daughter’s violin and stuffing the scroll in the violin’s f-hole.
She was fleeing for the wall when she was stopped by the hostiles.
Dance, said the hostiles, and they pointed their war clubs at her skull.
And these war clubs had a strange effect on the wife,
who began daydreaming about a man who wasn’t her husband.
She thought of cutting his hair in a sunflower patch in the village.
The time should be dusk, she thought, and the shears,
they should flash once in her hands like a scythe.
She thought there should be two swarms of no-see-ums,
one smoldering around each of her hands.
And she’d tilt back the head of the man who wasn’t her husband.
And she’d oil his throat with the badger brush in her hand.
And he’d smell the sandalwood lather she worked in the bristles.
And he’d smell the eau de cologne on her neck when she leaned in close.
And she’d shave his throat with the blade of a balisong.
And the woman thought each time he moaned when she stroked him
a dragonfly should dance from his mouth.
And he’ll moan until the dragonfly quits dancing, she thought.
And I’ll dance around his throat all night like a lantern.
“Because a war club doesn’t taste like a war club,” she said.
“It tastes like my husbands all breathing at once.”
She spoke these words with a hole in her skull in the snow.
And the smoke coming out of the hole was her thoughts.
And her body lying there in the village square was so beautiful
the hostiles began to dance on either side of the body.
And they danced, and they danced, until they too fell dead in the snow beside her.",Mythology and Folklore
Diameter,"You love your friend, so you fly across the country to see her.

Your friend is grieving. When you look at her, you see that something’s missing.

You look again. She seems all there: reading glasses, sarcasm, leather pumps.

What did you expect? Ruins? Demeter without arms in the British Museum?

Your friend says she believes there’s more pain than beauty in the world.

When Persephone was taken, Demeter damned the world for half the year.

The other half remained warm and bountiful; the Greeks loved symmetry.

On the plane, the man next to you read a geometry book, the lesson on finding the circumference of a circle.

On circumference: you can calculate the way around if you know the way across.

You try across with your friend. You try around.

I don’t believe in an afterlife, she says. But after K. died, I thought I might go after her.

                In case I’m wrong. In case she’s somewhere. Waiting.",Mythology and Folklore
The Satyr Proffered,"These grapes of stone were being proffered, friend.
— John Berryman
grapes, rough-touched and round, stone-
carved, to be squeezed into the fundaments
of rock wine. She imagines it would be cold,
not sought for its smoothness,
and likely full of grit
if not refined with care.

The satyr laughs carelessly
for one caught in stone.
The cracked edges of his mouth spill grit
as he leers after the loss of his fundaments
which fall along the smooth,
cold

torso plane, exhibiting immaculate coolness
at this literal loss of face. Carefully,
she strokes his head, as if smoothing
the fetlocks handcrafted from stone.
Her affection is unforced, a fundamental
attraction to those beautiful, gritty

things made lovely by decay, their gritted
teeth so much more interesting than the art gallery’s cold
geometrics, which appear fundamental
but fail to consider the careless
chaos spinning at the stone
center of all smooth

creations. And those grapes! Their unsmooth
surface mirrors the messy passion flushing the grit-
dusted cheek, the hideous mouth of crumbling stone.
What heat from the Dionysian’s cold,
brittle fruit! The obliteration of all care
if she could only perform the fundamental

act of eating. She thinks about wilderness, fun, mental
liberation, dancing her soles smooth,
pleasure as pervasive as care
is now, her feet a frenzied blur on the gritty
forest floor, shaking and pummeling out the cold
as she prances over starlit stones.

She does not care who sees her, as she grips the stone
grapes, feels the smooth, crumbling cold
enter her hand, fingers embracing a thing more fundamental than earth, bone, grit.",Mythology and Folklore
The Hove,"Such as there was in the littleness of that dawn
could not be this. Not, certainly, the hove
of an invasion fleet from Angleterre,
flotilla wrought of shipwright, chandler, armorer
as if Ice Age breeding stocks were on the move.

The Planners had their weather oracles,
haruspices their entrails. All divined
the red planet aligned, full-moon
visibility, high tides to clear
the beachhead obstacles — but iffy weather.

Gulls glean the wakes. Something of a factory —
diesel and air and the Jersey spirit spark —
of the hydrocarbon Gloriana makes
ungainly way in the valleys of the swells.
The shore emerges quaquaversally.

A Very pistol throats the air. Battlewagons
wheel for the presentation of the agon.
Shades of sherry fill the clouds with light.
Mike boats enter surf’s unscrolling rolls.
Empty jaws agape, the gods take note.

The odors of the offering, so rich
they start saliva flowing, must be painful
for the gods: not preamble for the meal,
the meal itself. Famished
they try to gorge the oily cooking smoke.

Amphibious landings to prevail require
the triumph of the small; circle in circle
perfected on parade grounds of the soul.
Committing an empire to the fire
calls for just-in-time ferocity.

They eat the savage honey. The boys pound sand.
Green eyes gammoning they all pound sand
until for the battle there was nothing left that day
but what the carrion patrols collect
for Paternosterers to sacristy.

They’re strong, these Irish penny whistle songs.
Just the one wild tone working alone
the registers, trying the proper sound
for sorrow. Ours for theirs,
theirs for theirs, ours for ours.

So many shouldering forward, enjambed
now cross the Styx with the ease of smoke
passing through a window screen    ...    depart
the shapes of things continuing for shapes
supercooled to the stillness of mortmain.

The business of the flag is never done.
It fills in the wind and fails, but never the same
akimbo twice. Each snap a fresh report
from acres of tended lawn
rankled by crosses perfectly plumb.",Mythology and Folklore
The Mermaids,"The spell is a mouth’s
perilous-o as they dark circle the boats in
their most resplendent pliable armor.

The concept fish aligning with girl
or love with death
to bring down men at sea, temptation

confused into offering,
the mismatch of like plus unlike
really likes, straight to rock bottom.

No equation has ever been this badass.
It’s the men who will enter the spell
so far into exhaustion as weather, as waves,

the tide pulling toward if, letting go then
over the whale road in the company of
the dolphin, the only other animal, I’m told,

who can do it solely for pleasure. It.
You know what I mean. The lower half
aglitter, the top half brainy as beautiful

is sometimes, murderous lovelies, their plotting
and resolve and why not
get these guys good, the lechers.

To see at all in the whirling, to hear
what anyone might
in wind roar and faint whistle —

don’t worry about girls shrewd
as whimsy, legend-tough
to the core. Don’t. But it’s

their spell too, isn’t it? Locked there.
Aligned with singing, dazzle
razor-blackened green. Not that they

miss what human is like or know any end
to waters half born to, from where
they look up.

Men in boats, so sick of the journey.
Men gone stupid with blue,
with vast, with gazing over and away

the whole time until same to same-old to
now they’re mean. After that, small.
Out there, the expanse. In here,

the expanse. The men look down. Aching
misalignment — gorgeous
lure that hides its hook steely sweet

to o my god, little fool’s breath
triumphant, all the way under and am I
not deserving?",Mythology and Folklore
