Ovid on Climate Change,"Bastard, the other boys teased him,
till Phaethon unleashed the steeds
of Armageddon. He couldn’t hold
their reins. Driving the sun too close
to earth, the boy withered rivers,
torched Eucalyptus groves, until the hills
burst into flame, and the people’s blood
boiled through the skin. Ethiopia,
land of   burnt faces. In a boy’s rage
for a name, the myth of race begins.",Mythology and Folklore
Southern Gothic,"About the dead having available to them
all breeds of knowledge,
some pure, others wicked, especially what is
future, and the history that remains
once the waters recede, revealing the land
that couldn’t reject or contain it, and the land
that is not new, is indigo, is ancient, lived
as all the trees that fit and clothe it are lived,
simple pine, oak, grand magnolia, he said
they frighten him, that what they hold in their silences
silences: sometimes a boy will slip
from his climbing, drown but the myth knows why,
sometimes a boy will swing with the leaves.",Mythology and Folklore
New Endymion,"She visits still too much, dressed in aromas
of fir needles, mango, mold: I still get lost
knowing she’s close, me not getting younger
or more conscious. Sometimes I fantasticate
I’m broad awake: her witchy presence waits
for me to jump into her arms, but then she’s just
an incoherent ache in sleep’s freaked scenes.
I feel her frosty nitrogenous hands and wrists
vaporing nooses around my head and feet
and genitals, conjuring my drab hair
into a party bowl of oiled, desirable locks.
She makes me nervous, but what would I do
without her? So long as I can’t have her,
I want her and this alarming manic frequency.
Then again, who wants to wake to change,
its pulped, smelly suit of meat, drawing flies?
My night-watch hot girl, moon-maiden, mom,
let me get just one night’s sleep without regret,
released from your foxy ticklish fondlings,
your latest smell of windblown fresh-cut grass.",Mythology and Folklore
Caryatid,"Renege on the rock! Smash
the oppressor cave! Sashay
out onto the floor! Scorn the cornices—
see, from the beard of drunk Silenus
from the unique uproar of his blood
the wine dribble into his genitals!

Spit on the obsession with pillars:
ancient rheumatic hands quake toward
gray skies. Bring down the temple
by the yearning of your knees
twitching with dance.

Spill, spread, unpetal, bleed
your soft flowers through great wounds.
Dove-hauled Venus girds her loins
with roses—
see the summer’s last puff of blue
drift on seas of asters to distant
pine-brown coasts; see
this final hour of our mendacious
southern happiness   
held aloft.",Mythology and Folklore
Incantation Against Lilith,"Veiled in velvet, is she here?
      Leave off, leave off:
           You shall not enter,
                you shall not emerge.
      It is neither yours nor your share.

Return...Return:
      The sea is swelling;
           its waves are calling.
                I hold to the holy portion—
      I am held in the holiness of the King.",Mythology and Folklore
To the One Who is Reading Me,"You are invulnerable. Didn’t they deliver
(those forces that control your destiny)
the certainty of dust? Couldn’t it be
your irreversible time is that river
in whose bright mirror Heraclitus read
his brevity? A marble slab is saved
for you, one you won’t read, already graved
with city, epitaph, dates of the dead.
And other men are also dreams of time,
not hardened bronze, purified gold. They’re dust
like you; the universe is Proteus.
Shadow, you’ll travel to what waits ahead,
the fatal shadow waiting at the rim.
Know this: in some way you’re already dead.",Mythology and Folklore
Epic Simile,"For Rachel
Right shoulder aching with day-long butchery,
Left shoulder numb with dints clanged on the shield,
The hero is fouled with blood, his own and others’,
First slick, then sticky, then caked, starting to mat
His beard—the armor deadweight all around him;
His teeth grit and rattle with every jolt
Of bronze-rimmed wheels behind the shit-flecked horses.
But when he glimpses the mountains, the distant snow,
A blankness swoons upon him, and he hears
Nothing but the white vowels of the wind
Brushing through stands of spears like conifers
While a banner slips its staff and hangs in the blue
Like a kestrel or a contrail. The hero’s death,
The prize, elusive quarry of his life,
Stands stock-still in her cloven tracks in snow
And turns, one ear tuned to the creek’s far bank,
One dished towards him. Her unstartled gaze
Beads on him like a sniper’s sights, until
At the clean report of a cracking poplar branch,
She leaps away like luck, over rapid water,
And snowfall scrims the scene like a mist of tears,
Like a migraine, like sweat or blood streaming into your eyes.",Mythology and Folklore
"Virgil, Aeneid, II, ii. 250–267","And now the heavens shift and the night comes in,
And covers with its darkness earth and sky
And the tricks of the Myrmidons. Throughout the city
The Trojans, wearied by joy, lie fast asleep.
And now the Greeks set out from Tenedos,
Their ships proceeding in an ordered line,
Under the friendly light of the silent moon,
Making their way toward the shore they know so well,
And when the royal galley’s beacon light
Is lighted, Sinon sees it, and quietly goes,
Protected by malign complicit fates,
And furtively opens up the Horse’s flank
And frees the Argive warriors from its womb.
The Horse releases them to the open air
And joyfully they come out: first come the captains
Thessander, and Sthenelus, and dire Ulysses,
Lowering themselves to the ground by means of a rope,
And Acamas and Thoas, and Pyrrhus, Achilles’ son,
And Machaon the prince, and Menelaus,
And Epeus, he, who contrived the Wooden Horse
That fooled us so. And then they enter the city,
That’s deep submerged in wine and unknowing sleep;
They surprise and kill the watch, and open the gates
To welcome in their comrades from the fleet,
Letting them in for what they are going to do.",Mythology and Folklore
Grendel’s Mother,"When the moon’s worn scutcheon
touches the flint-gray flood,
I will lave him in foxglove
and vetch until the blood
of his wretched heart heals.

Without a scar, he stood—

as the men make their way
into the quaking wood.",Mythology and Folklore
Like Gods,"The philosopher David Lewis spun a fantasy of two omniscient gods who know about one world, which might as well be ours. Each knows precisely all there is to know, the grand “totality of facts, not things.” Each knows the pattern of the light on each neglected leaf millennia ago. Each knows the number of the stars, their ages, all the distances between them, all the “things too tiny to be remembered in recorded history—the backfiring of a bus/In a Paris street in 1932,” as well as all the things that history distorts or just can’t see, like the thought that must have flashed across Patroklos’s mind (if he’d existed and had had a mind—the middle knowledge of the schoolmen) when Hektor split his stomach with a spear (if he’d existed too). Each one looks on, as though through ordinary eyes, as “Mme Swann’s enormous coachman, supervised by a groom no bigger than his fist and as infantile as St George in the picture, endeavored to curb the ardour of the quivering steel-tipped pinions with which they thundered over the ground,” and sees “the gray ‘toppers’ of old” the gentlemen strolling with her wore, the little “woolen cap from which stuck out two blade-like partridge feathers” that she wore (or would have worn if they and she’d been real). Each monitors the photons through the slits, the slow decay of radium, and knows the ratio of vermouth to gin in someone’s first martini at Larre’s. Each knows what Darragh, Geoff and Willy knew before the bullet or the pavement killed their worlds, and where the shots came from in Dallas. Each knows precisely what the other knows, in all the senses of those words, and if a question has a factual answer, each can answer it. Yet there’s a question neither can resolve: which god am I?

The question posits both a world and a unique perspective on that world, which neither has. And if gods One and Two could reify themselves by wondering who or what they were, they’d have to know the answer—and, because they don’t, they can’t. Could gods like those be real, in something like the sense that you and I are real? But then, what sense is that? Gods One and Two are you and I writ large: I wander out into the day and feel the sunlight on my face. I see the sunlight on the first spring leaves like green foam on the trees, and so do you. The world we have in common, that the gods can comprehend in its entirety, remains beyond my grasp, and yours. The world I know belongs entirely to me, as yours belongs entirely to you. I know my world completely, as the gods know ours, because it’s nothing but my take on things, and starts and ends with me. I’m both the author and the captive of my world, because my take on things is all there is to me. When Mary, in Frank Jackson’s philosophical diversion, wanders from her room of black and white and shades of gray and finally sees a rose, and then goes on in sunlight, into the Hofgarten, and drinks coffee, and talks for hours, it’s hard to see how all of this (as she might say) could be an artifact of her perspective. But it is.

So what? Philosophers tell stories, but they make them up, and what are they to me? Sometimes I think I’m humoring myself (a good thing I suppose) with an extended exercise in nonsense. Have breakfast, have a cup of strong black common sense, get over it, I tell myself, refuting Berkeley with my foot. Instead of this entanglement of self with self, why can’t I just relax into my place inside the natural order, be a thing within the solid scheme of things, a Dane in Denmark? How can fantasies, unreal by definition, show me what I am, and know? How can the poetry of possibilities dissolve the prose of facts? My little life sustains me while it can, and that’s enough. It may be all contingent, but it’s real, and when catastrophes occur, as they inevitably do, I’d rather they occur to me, instead of writing them away, or redefining happiness or sorrow or tranquility as alterations of some abstract point of view that points at nothing. Inescapable illusions must be real, or might as well be real, no matter where reflection on them leads; and if accepting them means taking things on faith, that’s fine. Who wants to be a posit, or a site of possibilities? Who wants to walk out and evaporate into this green spring day? Who wants to have sex with a wraith?

No matter where reflection on them leads. It leads, of course, to me. A cri de coeur is not an argument, but where the real argument begins. Hopkins: “searching nature I taste self at one tankard, that of my own being.” Kant: “the feeling of an existence without the least concept,” meaning that despite the certainty I have, I’ve no idea what I really am, or where, and as for “searching nature,” I have no idea even where to start. These matters mean the world to me, and yet no matter how I try to come to grips with them, they slip away. I and here and now are ever present, yet they vanish in the act of apprehension, as a poem turns into language as you write it down. Dimensionless, atemporal, imprisoned in the present—even as I say them to myself the words fall short of what I thought I started out to say, like the conclusion of an argument too close to me to share, or like an empty thought balloon that hangs above me in the air. It’s not the question of what makes me who I am through time—of how a figure in a photograph from 1985, a couple sitting in the garden of the small Hôtel des Marronniers just off the rue Jacob, could be the person who remembers her and thinks of him today—but of what constitutes me now, and of what made me then. If giving it a name won’t help, then neither will pretending it’s divine. If I should be supplanted by a bright recording angel knowing everything about me in the way the gods know all about their world, I wouldn’t have survived. She takes the whole thing in—the house on Maxim Street, the bike rides down the hill on Wabash Street, my high school friends, their friends, the friends of friends of friends—with eyes that monitor my back, my face, the traces in my brain projected on a screen, the n degrees of separation linking me to nearly everyone who’s ever lived, a thing within a wilderness of things, with each one locked inside a universe with no outside, of which there’s nothing she can see. How could it be an afterlife? It’s just a different life, another life, complete or incomplete as anyone’s, consumed by questions that elude it, not because she can’t remember, but because the words that make them up are undefined: which one of them was I? which world was mine?",Mythology and Folklore
Litany,"O you gods, you long-limbed animals, you
astride the sea and you unhammocked
in the cyprus grove and you with your hair
full of horses, please. My thoughts have turned
from the savor of plums to the merits
of pity—touch and interrupt me,
chasten me with waking, humble me
for wonder again. Seed god and husk god,
god of the open palm, you know me, you
know my mettle. See, my wrists are small.
O you, with glass-colored wind at your call
and you, whose voice is soft as a turned page,
whose voice unrolls paper, whose voice returns
air to its forms, send me a word for faith
that also means his thrum, his coax and surge
and her soft hollow, please—friend gods, lend me
a word that means what I would ask him for
so when he says: You give it all away,
I can say: I am not sorry. I sing.",Mythology and Folklore
Interpol 22019-1.7: The Head of the Hatra Apollo,"Missing from the National Museum, Baghdad, April 2003
No light can gild the sun god’s cheek but strains
through burlap now, Phoibos the refugee,
his head a marble cabbage in a sack
jouncing east by pickup down a dirt track
across Seleucid wastes, Parthian plains,
once more fortune’s tourist, bobbing free.
Or not—just stashed behind a rubbish mound
where bare-boned goats might crop a scraggy meal,
scant miles from the museum’s shattered room.
Stripped of laurels, his oracles, his loom
of sacred strings, no Horai here spin round,
just pacing men who wait to close the deal.
A goatherd sings, slings a Kalashnikov:
the godhead mute since looters hacked it off.",Mythology and Folklore
Who,"It was the blind girl from the rez who
stole the baker’s missing bread;
it was the guitar playing fool who crooned
and raced the wild mustangs through our heads.
It was the village idiot who played
his chess without the fool, the bowl
of soup who said too late, too late, too late
to blame the thread, the spoon, the text, the mole.

Beside the waterfall of fallen things
just east of town, it was the bearded man
attaching fallen things to angel’s wings
while singing legends to the long, long grass.

It was the moon who laughed and laughed.
It was the moon who laughed herself in half.",Mythology and Folklore
Thetis’ Heel,"Even gods, though they were born
in our own heads, died out to myth.

Just as no one can point to the source
of the spring or later at sea can say: this

is the water from deep in the earth, that
flowed from the mountaintops, so

is the stream of mortals and gods.

About my origins I know
nothing. I married the earth, a child

grew in me, fell
out of me at last, and I

babbled: little mutt of mine, I’ll
name you, dunk you in invulnerability.

He smiled at me, held me tightly
by the heel and said mama.",Mythology and Folklore
absence or a record of the creation of a fabulous animal,"on the first day you were beautiful and good
on the second you grew a horn
on the third a lead-gray wing budded
from your shoulder
on the fourth a claw sprouted from your shoe
on the fifth you flew
right into my armpit
built a nest and then lost interest
on the sixth you were a host of leeches
having their way with my veins
on the seventh I heard you
trotting above me with hollow hoof beats
on the eighth you went to moses to ask for advice
winged horned buraq the prophet’s steed
returned as a lamb on the ninth
to graze on my belly fur
on the tenth you died for isaac
the angel decided in favor of animal testing
on the eleventh I had forgotten the color of your eyes
on the twelfth day you were poor and naked
on the thirteenth you were lying on the bottom of the sea
a millions of eons old whispering mussel
on the fourteenth they called you into the field
duldul, ali’s tireless gray mule
on the fifteenth you stood still
welded on the lip of a kettle
the sweat of the holy brew had oxidized
your copper neck
on the sixteenth you were the primordial ox
zarathustra sang of your suffering
on the seventeenth day when I came home
you were once again the one human being",Mythology and Folklore
Fairy-tale Logic,"Fairy tales are full of impossible tasks:
Gather the chin hairs of a man-eating goat,
Or cross a sulphuric lake in a leaky boat,
Select the prince from a row of identical masks,
Tiptoe up to a dragon where it basks
And snatch its bone; count dust specks, mote by mote,
Or learn the phone directory by rote.
Always it’s impossible what someone asks—

You have to fight magic with magic. You have to believe
That you have something impossible up your sleeve,
The language of snakes, perhaps, an invisible cloak,
An army of ants at your beck, or a lethal joke,
The will to do whatever must be done:
Marry a monster. Hand over your firstborn son.",Mythology and Folklore
In Memory of Bryan Lathrop,"Who bequeathed to Chicago a School of Music.
   So in Pieria, from the wedded bliss
Of Time and Memory, the Muses came
To be the means of rich oblivion,
And rest from cares.  And when the Thunderer
Took heaven, then the Titans warred on him
For pity of mankind. But the great law,
Which is the law of music, not of bread,
Set Atlas for a pillar, manacled
His brother to the rocks of the Scythia,
And under Aetna fixed the furious Typhon.
So should thought rule, not force. And Amphion,
Pursuing justice, entered Thebes and slew
His mother's spouse; but when he would make sure
And fortify the city, then he took
The lyre that Hermes gave, and played, and watched
The stones move and assemble, till a wall
Engirded Thebes and kept the citadel
Beyond the reach of arrows and of fire.
What other power but harmony can build
A city, and what gift so magical
As that by which a city lifts its walls?
So men, in years to come, shall feel the power
Of this man moving through the high-ranged thought
Which plans for beauty, builds for larger life.
The stones shall rise in towers to answer him.",Mythology and Folklore
The Broken String,"Nuing-kuiten my father’s friend   
was a lion sorcerer   
and walked on feet of hair.   
People saw his spoor and said:   
“The sorcerer has visited us.   
He is the one who treads on hair.   
This big animal prowling   
was Nuing-kuiten.”   

He used to travel by night—
he did not want to be seen   
for people might shoot at him   
and he might maul someone.   
At night he could go unseen,   
after other lion sorcerers   
who slink into our dwellings   
and drag out men.   

The sorcerer lived with us   
hunting in a lion’s form   
until an ox fell prey to him.   
Then the Boers rode out   
and shot my father’s friend,   
but he fought those people off   
and came home to tell father   
how Boers had wounded him.   

He thought father did not know   
he was wounded in his lion form.   
Soon he would have to go   
for he lay in extreme pain.   
If only he could take father   
and teach him his magic and songs,   
father would walk in his craft,   
sing his songs, and remember him.
He died, and my father sang:   

“Men broke the string for me   
and made my dwelling like this.   
Men broke the string for me   
and now   
my dwelling is strange to me.   

My dwelling stands empty   
because the string has broken,   
and now   
my dwelling is a hardship for me.”   ",Mythology and Folklore
The Corn Baby,"They brought it. It was brought   
from the field, the last sheaf, the last bundle   

the latest and most final armful. Up up   
over the head, hold it, hold it high it held   

the gazer’s gaze, it held hope, did hold it.   
Through the stubble of September, on shoulders   

aloft, hardly anything, it weighed, like a sparrow,   
it was said, something winged, hollow, though   

pulsing, freed from the field   
where it flailed in wind, where it waited, wanted   

to be found and bound with cord. It had   
limbs, it had legs. And hands. It had fingers.   

Fingers and a face peering from the stalks,   
shuttered in the grain, closed, though just a kernel   

a shut corm. They brought him and autumn   
rushed in, tossed its cape of starlings,   

tattered the frost-spackled field.",Mythology and Folklore
Waumandee,"A man with binoculars   
fixed a shape in the field   
and we stopped and saw   

the albino buck browsing   
in the oats—white dash   
on a page of green,   

flick of a blade   
cutting paint to canvas.   
It dipped its head   

and green effaced the white,   
bled onto the absence that   
the buck was—animal erasure.   

Head up again, its sugar legs   
pricked the turf, pink   
antler prongs brushed at flies.   

Here in a field was the imagined world   
made visible—a mythical beast   
filling its rumen with clover   

until all at once it startled,   
flagged its bright tail—   
auf Wiedersehen, surrender—   

and leapt away—   
a white tooth   
in the closing mouth of the woods.",Mythology and Folklore
